{
  "id": "so_arm101",
  "display_name": "SO-ARM101",
  "arms": 1,
  "dof_per_arm": 5,
  "joint_names": [
    "Rotation", "Pitch", "Elbow", "Wrist_Pitch", "Wrist_Roll", "Jaw"
  ],
  "joint_limits": {
    "min": [
      -1.92, -3.32, -0.174, -1.66, -2.79, -0.174
    ],
    "max": [
      1.92, 0.174, 3.14, 1.66, 2.79, 1.75
    ]
  },
  "gripper_range": [0.0, 1.0],
  "base_frame": "base",
  "assets": {
    "urdf": "",
    "mjcf": "models/so_arm100/so_arm100.xml",
    "glb": "models/so_arm100/glb/so_arm100.glb",
    "skeleton": ""
  },
  "teleop": {
    "default_pos_scale": 0.5,
    "workspace_box": [[-0.3, -0.3, 0.0], [0.3, 0.3, 0.45]]
  }
}