{
  "id": "ego_human_5cam_v1",
  "display_name": "Ego Human 5-Cam v1",
  "arms": 2,
  "dof_per_arm": 7,
  "joint_names": [
    "left_shoulder_pitch", "left_shoulder_roll", "left_shoulder_yaw",
    "left_elbow",
    "left_wrist_roll", "left_wrist_pitch", "left_wrist_yaw",
    "right_shoulder_pitch", "right_shoulder_roll", "right_shoulder_yaw",
    "right_elbow",
    "right_wrist_roll", "right_wrist_pitch", "right_wrist_yaw"
  ],
  "joint_limits": {
    "min": [
      -2.897, -1.762, -2.897, -2.094,
      -1.745, -1.309, -1.745,
      -2.897, -1.762, -2.897, -2.094,
      -1.745, -1.309, -1.745
    ],
    "max": [
      2.897, 1.762, 2.897, 0.0,
      1.745, 1.309, 1.745,
      2.897, 1.762, 2.897, 0.0,
      1.745, 1.309, 1.745
    ]
  },
  "gripper_range": [0.0, 1.0],
  "base_frame": "pelvis",
  "assets": {
    "urdf": "",
    "mjcf": "",
    "glb": "models/ego_human/glb/ego_human.glb",
    "skeleton": "models/ego_human/skeleton.json"
  },
  "teleop": {
    "default_pos_scale": 1.0,
    "workspace_box": [[-0.5, -0.5, -0.3], [0.5, 0.5, 1.0]]
  },
  "capture": {
    "default_fps": 30,
    "max_duration_s": 180,
    "cameras": [
      { "name": "wide_l",   "resolution": [1920, 1200], "fps": 60, "lens": "rectilinear", "fov_deg": 144 },
      { "name": "wide_r",   "resolution": [1920, 1200], "fps": 60, "lens": "rectilinear", "fov_deg": 144 },
      { "name": "fisheye_l","resolution": [1920, 1200], "fps": 30, "lens": "fisheye", "fov_deg": 200 },
      { "name": "fisheye_c","resolution": [1920, 1200], "fps": 30, "lens": "fisheye", "fov_deg": 200 },
      { "name": "fisheye_r","resolution": [1920, 1200], "fps": 30, "lens": "fisheye", "fov_deg": 200 }
    ],
    "reference_camera": "fisheye_c",
    "calibration": {
      "hand_eye_required": false
    }
  }
}